<xsd:schema targetNamespace="https://jg80.github.io/CSE445AS4" elementFormDefault="qualified" attributeFormDefault="unqualified">
<xsd:element name="Hotels" type="HotelsType"/>
<xsd:complexType name="HotelsType">
<xsd:sequence>
<xsd:element name="Hotel" type="HotelDetails" minOccurs="1" maxOccurs="unbounded"/>
</xsd:sequence>
</xsd:complexType>
<xsd:complexType name="HotelDetails">
<xsd:sequence>
<xsd:element name="Name" type="xsd:string" minOccurs="1" maxOccurs="1"/>
<xsd:element name="Phone" type="PhoneType" minOccurs="1" maxOccurs="unbounded"/>
<xsd:element name="Address" type="AddressType" minOccurs="1" maxOccurs="1"/>
<xsd:attribute name="Rating" type="xsd:float" use="optional"/>
</xsd:sequence>
</xsd:complexType>
<xsd:complexType name="AddressType">
<xsd:sequence>
<xsd:element name="Number" type="xsd:positiveInteger" minOccurs="1" maxOccurs="1"/>
<xsd:element name="Street" type="xsd:string" minOccurs="1" maxOccurs="1"/>
<xsd:element name="City" type="xsd:string" minOccurs="1" maxOccurs="1"/>
<xsd:element name="State" type="xsd:string" minOccurs="1" maxOccurs="1"/>
<xsd:element name="Zip" type="xsd:positiveInteger" minOccurs="1" maxOccurs="1"/>
<xsd:attribute name="Nearest Airport" type="xsd:string" use="required"/>
</xsd:sequence>
</xsd:complexType>
<xsd:simpleType name="PhoneType">
<xsd:restriction base="xsd:string">
<xsd:pattern value="\d{3}\-\d{3}\-\d{4}"/>
</xsd:restriction>
</xsd:simpleType>
</xsd:schema>